{
  "plan_ref": {
    "path": "<PLAN_PATH>"
  },
  "preconditions": {
    "mismatches": [],
    "verified": true
  },
  "repo": {
    "root": "<REPO_ROOT>"
  },
  "results": [
    {
      "files": [
        {
          "path": "Cargo.toml",
          "sha256_after": "ce375826aa75d77065db58fe3a2243a7375f3c1a15e92d09dc3d0bfc72fb45be",
          "sha256_before": "b5789e0f39065d9b60d6fc1fe301bba64ace773bd5d0e192f671db9fbf6a611a"
        }
      ],
      "op_id": "5bc5e0d5-96a1-53ac-86d3-b960dfb7747e",
      "status": "applied"
    },
    {
      "files": [
        {
          "path": "crates/a/Cargo.toml",
          "sha256_after": "5cd12110f86db798760f5d3f7f2fe9e2b5b3e119129e535c03f54e93f6c81f76",
          "sha256_before": "dd041b75f4c9e85099ed87073d82c80f8132c1106babd98929d677d35ff3ddb8"
        }
      ],
      "op_id": "c00514e9-2fc1-535b-81ca-04d634ddb6c7",
      "status": "applied"
    },
    {
      "files": [
        {
          "path": "crates/b/Cargo.toml",
          "sha256_after": "2bea5cf97bc8e94ce555ec1190bb5a151c1b228efb34abeaac9c3a2d20ecc73e",
          "sha256_before": "6a87a9c3244da870a92da037cab8106c930ccfd47e8768bd39b500a2fce78ce9"
        }
      ],
      "op_id": "31611d71-cd8b-5ec3-980c-2e33851d778e",
      "status": "applied"
    }
  ],
  "schema": "buildfix.apply.v1",
  "summary": {
    "applied": 3,
    "attempted": 3,
    "blocked": 0,
    "failed": 0,
    "files_modified": 3
  },
  "tool": {
    "name": "buildfix",
    "version": "test"
  }
}