{
  "plan_ref": {
    "path": "<PLAN_PATH>"
  },
  "preconditions": {
    "mismatches": [],
    "verified": true
  },
  "repo": {
    "root": "<REPO_ROOT>"
  },
  "results": [
    {
      "files": [
        {
          "path": "crates/a/Cargo.toml",
          "sha256_after": "fe192b73f29f081c33607c15171b9e925068428147185d78defa05f2fba3c198",
          "sha256_before": "de0525ad8a4368de30fd2f01ab4b777f313e13f49f838d13e321a7e336eec14e"
        }
      ],
      "op_id": "57fb44c4-888e-57e5-8b1b-4374618cfc32",
      "status": "applied"
    }
  ],
  "schema": "buildfix.apply.v1",
  "summary": {
    "applied": 1,
    "attempted": 1,
    "blocked": 0,
    "failed": 0,
    "files_modified": 1
  },
  "tool": {
    "name": "buildfix",
    "version": "test"
  }
}