{
  "plan_ref": {
    "path": "<PLAN_PATH>"
  },
  "preconditions": {
    "mismatches": [],
    "verified": true
  },
  "repo": {
    "root": "<REPO_ROOT>"
  },
  "results": [
    {
      "files": [
        {
          "path": "crates/a/Cargo.toml",
          "sha256_after": "14a01f66508b4233646e0991a3dd51c6b43fe202a9f1a22aa8cdf50c3637a4df",
          "sha256_before": "3cd4cf5963c30863406ed72dd6b4ebe0f2df71ab007654de9d9b535d3ed09d6f"
        }
      ],
      "op_id": "cca08d34-3186-5420-9b9e-56f75695ef63",
      "status": "applied"
    }
  ],
  "schema": "buildfix.apply.v1",
  "summary": {
    "applied": 1,
    "attempted": 1,
    "blocked": 0,
    "failed": 0,
    "files_modified": 1
  },
  "tool": {
    "name": "buildfix",
    "version": "test"
  }
}