{
  "plan_ref": {
    "path": "<PLAN_PATH>"
  },
  "preconditions": {
    "mismatches": [],
    "verified": true
  },
  "repo": {
    "root": "<REPO_ROOT>"
  },
  "results": [
    {
      "files": [
        {
          "path": "crates/a/Cargo.toml",
          "sha256_after": "d400a530a682fad2c467d1a818a3bafbcf03b29d217c6bed27823242bb3a5fbe",
          "sha256_before": "ad0d8c4d8094a89cb688a3fca468108eafa68e98074cfcbb95f520e9968d68e3"
        }
      ],
      "op_id": "54c07fcf-11fc-5d08-86f2-0da50f659785",
      "status": "applied"
    }
  ],
  "schema": "buildfix.apply.v1",
  "summary": {
    "applied": 1,
    "attempted": 1,
    "blocked": 0,
    "failed": 0,
    "files_modified": 1
  },
  "tool": {
    "name": "buildfix",
    "version": "test"
  }
}