{
  "plan_ref": {
    "path": "<PLAN_PATH>"
  },
  "preconditions": {
    "mismatches": [],
    "verified": true
  },
  "repo": {
    "root": "<REPO_ROOT>"
  },
  "results": [
    {
      "files": [
        {
          "path": "crates/a/Cargo.toml",
          "sha256_after": "267e24bd7c8cbd145686b1ac5e175d5ac2112bc457d8f475e055ce07f7163285",
          "sha256_before": "a380c7dd5bfc25c20ebdf454ab309d16055aaed39dc166c6f014493e73975b4e"
        }
      ],
      "op_id": "70120bf0-49e2-538b-a79a-3d16cdc86b4c",
      "status": "applied"
    }
  ],
  "schema": "buildfix.apply.v1",
  "summary": {
    "applied": 1,
    "attempted": 1,
    "blocked": 0,
    "failed": 0,
    "files_modified": 1
  },
  "tool": {
    "name": "buildfix",
    "version": "test"
  }
}